{
  "interference_structure": "network_interference",
  "data_design": "randomized_individual",
  "desired_estimand": "direct_and_spillover",
  "exposure_mapping_status": "specified",
  "network_or_cluster_observed": "complete",
  "treatment_assignment_known": true,
  "own_treatment_available": true,
  "peer_treatment_available": true,
  "support_across_exposures": "adequate",
  "spillover_direction": "known",
  "timing_known": true,
  "contamination_risk": "moderate",
  "homophily_confounding_risk": "low",
  "network_missingness_risk": "low",
  "cluster_count": 60,
  "noncompliance": false,
  "geographic": false,
  "longitudinal_panel": false,
  "needs_experiment_design": false,
  "outcome_type": "continuous",
  "language": "r"
}
